<?xml version="1.0" encoding="UTF-8"?>
<sts:SpaceTransportationService
	xmlns:sts="http://cs.york.ac.uk/ecss/examples/spacetransportationservice"
	xmlns:xsi="http://www.w3.org/2001/XMLSchema-instance"
	xsi:schemaLocation="http://cs.york.ac.uk/ecss/examples/spacetransportationservice spacetransportationservice-anyElement-operatorServices.xsd ">
	
	<launchSite locationLatitude="0.0" locationLongitude="0.0"
		name="" numberOfLaunchpads="0" operational="true">
		<launchSiteId>idvalue0</launchSiteId>
		<physicalProperty type="LENGTH" unit=""
			value="0.0" />
		<operator>
			<operatorName>NASA</operatorName>
			
		</operator>
	</launchSite>
	
	<engineType fuelKind="" name="">
		<engineTypeId>idvalue1</engineTypeId>
	</engineType>
	
	<spacecraft countryOfOrigin="" manufacturer="" name=""
		relaunchCostInMioUSD="0">
		<stages engineAmount="0" name="">
			<engineType>idvalue1</engineType>
			<physicalProperty type="LENGTH" unit=""
				value="0.0" />
		</stages>
		<functions>MARS_COLONIZATION</functions>
		<physicalProperty type="LENGTH" unit=""
			value="0.0" />
		<launchSite>idvalue0</launchSite>
	</spacecraft>
	
</sts:SpaceTransportationService>
